{
  "$schema": "https://json-schema.org/draft/2020-12/schema",
  "title": "Rollout Report",
  "type": "object",
  "required": ["tenantId", "caseId", "candidateId", "stage", "status", "metrics", "recordedAt"],
  "properties": {
    "tenantId": { "type": "string" },
    "caseId": { "type": "string" },
    "candidateId": { "type": "string" },
    "stage": { "enum": ["shadow", "canary", "live"] },
    "status": { "enum": ["pass", "fail"] },
    "metrics": {
      "type": "array",
      "items": {
        "type": "object",
        "required": ["name", "value"],
        "properties": {
          "name": { "type": "string" },
          "value": { "type": "number" },
          "labels": {
            "type": "object"
          }
        },
        "additionalProperties": false
      }
    },
    "notes": {
      "type": "array",
      "items": { "type": "string" }
    },
    "recordedAt": { "type": "string" }
  },
  "additionalProperties": false
}
